name,primaryMuscles,secondaryMuscles,equipment,mechanic,force,movement_pattern,difficulty_level,category,instructions,order_priority,goal_Strength,goal_Muscle,goal_WeightLoss,goal_Endurance,goal_General,Strength_min_reps,Strength_max_reps,Strength_rest_s,Strength_sets,Muscle_min_reps,Muscle_max_reps,Muscle_rest_s,Muscle_sets,WeightLoss_min_reps,WeightLoss_max_reps,WeightLoss_rest_s,WeightLoss_sets,Endurance_min_reps,Endurance_max_reps,Endurance_rest_s,Endurance_sets,General_min_reps,General_max_reps,General_rest_s,General_sets
Front Cone Hops (or hurdle hops),quadriceps,abductors|adductors|calves|glutes|hamstrings,other,compound,push,squat,2,plyometrics,"Set up a row of cones or other small barriers, placing them a few feet apart. Stand in front of the first cone with your feet shoulder width apart. This will be your starting position. Begin by jumping with both feet over the first cone, swinging both arms as you jump. Absorb the impact of landing by bending the knees, rebounding out of the first leap by jumping over the next cone. Continue until you have jumped over all of the cones.",2,9,8,7,6,8,3,6,180,4,8,12,90,3,12,20,45,3,15,25,30,3,8,15,60,3
Front Dumbbell Raise,shoulders,,dumbbell,isolation,push,shoulder_raise,2,strength,"Pick a couple of dumbbells and stand with a straight torso and the dumbbells on front of your thighs at arms length with the palms of the hand facing your thighs. This will be your starting position. While maintaining the torso stationary (no swinging), lift the left dumbbell to the front with a slight bend on the elbow and the palms of the hands always facing down. Continue to go up until you arm is slightly above parallel to the floor. Exhale as you execute this portion of the movement and pause for a second at the top. Inhale after the second pause. Now lower the dumbbell back down slowly to the starting position as you simultaneously lift the right dumbbell. Continue alternating in this fashion until all of the recommended amount of repetitions have been performed for each arm.",5,5,9,7,8,7,6,10,120,3,10,15,60,3,15,25,30,3,20,30,20,2,10,15,60,3
Front Incline Dumbbell Raise,shoulders,,dumbbell,isolation,push,shoulder_raise,2,strength,"Sit down on an incline bench with the incline set anywhere between 30 to 60 degrees while holding a dumbbell on each hand. Tip: You can change the angle to hit the muscle a little differently each time. Extend your arms straight in front of you and have your palms facing down with the dumbbells raised about 1 inch above your thighs. This will be your starting position. Slowly raise the dumbbells straight up until they are slightly above your shoulders, while keeping your elbows locked. Squeeze at the top for a second and make sure you breathe out during this portion of the movement. Tip: Keep your head resting down against the bench and your legs on the floor at all times. Lower the arms back to the starting position as you inhale. Repeat for the recommended amount of repetitions.",5,5,9,7,8,7,6,10,120,3,10,15,60,3,15,25,30,3,20,30,20,2,10,15,60,3
Front Plate Raise,shoulders,,other,isolation,push,shoulder_raise,3,strength,"While standing straight, hold a barbell plate in both hands at the 3 and 9 o'clock positions. Your palms should be facing each other and your arms should be extended and locked with a slight bend at the elbows and the plate should be down near your waist in front of you as far as you can go. Tip: The arms will remain in this position throughout the exercise. This will be your starting position. Slowly raise the plate as you exhale until it is a little above shoulder level. Hold the contraction for a second. Tip: make sure that you do not swing the weight or bend at the elbows. Your torso should remain stationary throughout the movement as well. As you inhale, slowly lower the plate back down to the starting position. Repeat for the recommended amount of repetitions.",5,5,9,7,8,7,6,10,120,3,10,15,60,3,15,25,30,3,20,30,20,2,10,15,60,3
Front Raise And Pullover,chest,lats|shoulders|triceps,barbell,isolation,pull,shoulder_raise,2,strength,"Lie on a flat bench while holding a barbell using a palms down grip that is about 15 inches apart. Place the bar on your upper thighs, extend your arms and lock them while keeping a slight bend on the elbows. This will be your starting position. Now raise the weight using a semicircular motion and keeping your arms straight as you inhale. Continue the same movement until the bar is on the other side above your head . (Tip: the bar will travel approximately 180-degrees). At this point your arms should be parallel to the floor with the palms of your hands facing the ceiling. Now return the barbell to the starting position by reversing the motion as you exhale. Repeat for the recommended amount of repetitions.",5,5,9,7,8,7,6,10,120,3,10,15,60,3,15,25,30,3,20,30,20,2,10,15,60,3
Front Squat (Clean Grip),quadriceps,abdominals|glutes|hamstrings,barbell,compound,push,squat,3,strength,"To begin, first set the bar in a rack slightly below shoulder level. Rest the bar on top of the deltoids, pushing into the clavicles, and lightly touching the throat. Your hands should be in a clean grip, touching the bar only with your fingers to help keep it in position. Lift the bar off the rack by first pushing with your legs and at the same time straightening your torso. Step away from the rack and position your legs using a shoulder width medium stance with the toes slightly pointed out. Keep your head and elbows up at all times. This will be your starting position. Bend at the knees, sitting down between your legs. Continue down until your hamstrings are on your calves. Keep your knees aligned with your feet by consciously using your abductors to push your knees out as you squat. Begin to raise the bar as you exhale by pushing the floor mainly with the heel or middle of your foot as you straighten the legs again and return to the starting position.",2,9,8,7,6,8,3,6,180,4,8,12,90,3,12,20,45,3,15,25,30,3,8,15,60,3
Front Squats With Two Kettlebells,quadriceps,calves|glutes,kettlebells,compound,push,squat,3,strength,"Clean two kettlebells to your shoulders. Clean the kettlebells to your shoulders by extending through the legs and hips as you pull the kettlebells towards your shoulders. Rotate your wrists as you do so. Looking straight ahead at all times, squat as low as you can and pause at the bottom. As you squat down, push your knees out. You should squat between your legs, keeping an upright torso, with your head and chest up. Rise back up by driving through your heels and repeat.",2,9,8,7,6,8,3,6,180,4,8,12,90,3,12,20,45,3,15,25,30,3,8,15,60,3
Front Two-Dumbbell Raise,shoulders,,dumbbell,isolation,push,shoulder_raise,2,strength,"Pick a couple of dumbbells and stand with a straight torso and the dumbbells on front of your thighs at arms length with the palms of the hand facing your thighs. This will be your starting position. While maintaining the torso stationary (no swinging), lift the dumbbells to the front with a slight bend on the elbow and the palms of the hands always facing down. Continue to go up until you arms are slightly above parallel to the floor. Exhale as you execute this portion of the movement and pause for a second at the top. As you inhale, lower the dumbbells back down slowly to the starting position. Repeat for the recommended amount of repetitions.",5,5,9,7,8,7,6,10,120,3,10,15,60,3,15,25,30,3,20,30,20,2,10,15,60,3
Full Range-Of-Motion Lat Pulldown,lats,biceps|middle back|shoulders,cable,compound,pull,vertical_pull,3,strength,"Either standing or seated on a high bench, grasp two stirrup cables that are attached to the high pulleys. Grab with the opposing hand so your arms are crisscrossed about you and your palms are facing forward. Keeping your chest up and maintaining a slight arch in your lower back, pull the handles down as if you were doing a regular pulldown. The range of motion will be more of an arc. During the movement, rotate your hands so that in the bottom position your palms face each other rather than forward. Return slowly to the starting position and repeat.",2,9,8,7,6,8,3,6,180,4,8,12,90,3,12,20,45,3,15,25,30,3,8,15,60,3
Gironda Sternum Chins,lats,biceps|middle back,other,compound,pull,vertical_pull,3,strength,"Grasp the pull-up bar with a shoulder width underhand grip. Now hang with your arms fully extended and stick your chest out and lean back. Tip: You will be leaning back throughout the entire movement. This will be your starting position. Start pulling yourself towards the bar with your spine arched throughout the movement and your head leaning back as far away from the bar as possible. Exhale as you perform this portion of the movement. Tip: At the upper end of the movement, your hips and legs will be at about a 45-degree angle to the floor. Keep pulling until your collarbone passes the bar and your lower chest or sternum area touches it. Hold that contraction for a second. Tip: By the time you've completed this portion of the movement; your head will be parallel to the floor. Slowly start going back to the starting position as you inhale. Repeat for the recommended amount of repetitions.",2,9,8,7,6,8,3,6,180,4,8,12,90,3,12,20,45,3,15,25,30,3,8,15,60,3
Glute Ham Raise,hamstrings,calves|glutes,machine,isolation,pull,knee_flexion,3,powerlifting,"Begin by adjusting the equipment to fit your body. Place your feet against the footplate in between the rollers as you lie facedown. Your knees should be just behind the pad. Start from the bottom of the movement. Keep your back arched as you begin the movement by flexing the knees. Drive your toes into the foot plate as you do so. Keep your upper body straight, and continue until your body is upright. Return to the starting position, keeping your descent under control.",5,5,9,7,8,7,6,10,120,3,10,15,60,3,15,25,30,3,20,30,20,2,10,15,60,3
Glute Kickback,glutes,hamstrings,body only,isolation,push,hip_hinge,2,strength,"Kneel on the floor or an exercise mat and bend at the waist with your arms extended in front of you (perpendicular to the torso) in order to get into a kneeling push-up position but with the arms spaced at shoulder width. Your head should be looking forward and the bend of the knees should create a 90-degree angle between the hamstrings and the calves. This will be your starting position. As you exhale, lift up your right leg until the hamstrings are in line with the back while maintaining the 90-degree angle bend. Contract the glutes throughout this movement and hold the contraction at the top for a second. Tip: At the end of the movement the upper leg should be parallel to the floor while the calf should be perpendicular to it. Go back to the initial position as you inhale and now repeat with the left leg. Continue to alternate legs until all of the recommended repetitions have been performed.",5,5,9,7,8,7,6,10,120,3,10,15,60,3,15,25,30,3,20,30,20,2,10,15,60,3
Goblet Squat,quadriceps,calves|glutes|hamstrings|shoulders,kettlebells,compound,push,squat,2,strength,"Stand holding a light kettlebell by the horns close to your chest. This will be your starting position. Squat down between your legs until your hamstrings are on your calves. Keep your chest and head up and your back straight. At the bottom position, pause and use your elbows to push your knees out. Return to the starting position, and repeat for 10-20 repetitions.",2,9,8,7,6,8,3,6,180,4,8,12,90,3,12,20,45,3,15,25,30,3,8,15,60,3
Good Morning,hamstrings,abdominals|glutes|lower back,barbell,compound,push,hip_hinge,3,powerlifting,"Begin with a bar on a rack at shoulder height. Rack the bar across the rear of your shoulders as you would a power squat, not on top of your shoulders. Keep your back tight, shoulder blades pinched together, and your knees slightly bent. Step back from the rack. Begin by bending at the hips, moving them back as you bend over to near parallel. Keep your back arched and your cervical spine in proper alignment. Reverse the motion by extending through the hips with your glutes and hamstrings. Continue until you have returned to the starting position.",2,9,8,7,6,8,3,6,180,4,8,12,90,3,12,20,45,3,15,25,30,3,8,15,60,3
Good Morning off Pins,hamstrings,abdominals|glutes|lower back,barbell,compound,push,hip_hinge,3,powerlifting,"Begin with a bar on a rack at about the same height as your stomach. Bend over underneath the bar and rack the bar across the rear of your shoulders as you would a power squat, not on top of your shoulders. At the proper height, you should be near parallel to the floor when bent over. Keep your back tight, shoulder blades pinched together, and your knees slightly bent. Keep your back arched and your cervical spine in proper alignment. Begin the motion by extending through the hips with your glutes and hamstrings, and you are standing with the weight. Slowly lower the weight back to the pins returning to the starting position.",2,9,8,7,6,8,3,6,180,4,8,12,90,3,12,20,45,3,15,25,30,3,8,15,60,3
Gorilla Chin/Crunch,abdominals,biceps|lats,body only,compound,pull,core_flexion,3,strength,"Hang from a chin-up bar using an underhand grip (palms facing you) that is slightly wider than shoulder width. Now bend your knees at a 90 degree angle so that the calves are parallel to the floor while the thighs remain perpendicular to it. This will be your starting position. As you exhale, pull yourself up while crunching your knees up at the same time until your knees are at chest level. You will stop going up as soon as your nose is at the same level as the bar. Tip: When you get to this point you should also be finishing the crunch at the same time. Slowly start to inhale as you return to the starting position. Repeat for the recommended amount of repetitions.",2,9,8,7,6,8,3,6,180,4,8,12,90,3,12,20,45,3,15,25,30,3,8,15,60,3
Hack Squat,quadriceps,calves|glutes|hamstrings,machine,compound,push,squat,2,strength,"Place the back of your torso against the back pad of the machine and hook your shoulders under the shoulder pads provided. Position your legs in the platform using a shoulder width medium stance with the toes slightly pointed out. Tip: Keep your head up at all times and also maintain the back on the pad at all times. Place your arms on the side handles of the machine and disengage the safety bars (which on most designs is done by moving the side handles from a facing front position to a diagonal position). Now straighten your legs without locking the knees. This will be your starting position. (Note: For the purposes of this discussion we will use the medium stance described above which targets overall development; however you can choose any of the three stances described in the foot positioning section). Begin to slowly lower the unit by bending the knees as you maintain a straight posture with the head up (back on the pad at all times). Continue down until the angle between the upper leg and the calves becomes slightly less than 90-degrees (which is the point in which the upper legs are below parallel to the floor). Inhale as you perform this portion of the movement. Tip: If you performed the exercise correctly, the front of the knees should make an imaginary straight line with the toes that is perpendicular to the front. If your knees are past that imaginary line (if they are past your toes) then you are placing undue stress on the knee and the exercise has been performed incorrectly. Begin to raise the unit as you exhale by pushing the floor with mainly with the heel of your foot as you straighten the legs again and go back to the starting position. Repeat for the recommended amount of repetitions.",2,9,8,7,6,8,3,6,180,4,8,12,90,3,12,20,45,3,15,25,30,3,8,15,60,3
Hammer Curls,biceps,,dumbbell,isolation,pull,elbow_flexion,2,strength,"Stand up with your torso upright and a dumbbell on each hand being held at arms length. The elbows should be close to the torso. The palms of the hands should be facing your torso. This will be your starting position. Now, while holding your upper arm stationary, exhale and curl the weight forward while contracting the biceps. Continue to raise the weight until the biceps are fully contracted and the dumbbell is at shoulder level. Hold the contracted position for a brief moment as you squeeze the biceps. Tip: Focus on keeping the elbow stationary and only moving your forearm. After the brief pause, inhale and slowly begin the lower the dumbbells back down to the starting position. Repeat for the recommended amount of repetitions.",5,5,9,7,8,7,6,10,120,3,10,15,60,3,15,25,30,3,20,30,20,2,10,15,60,3
Hammer Grip Incline DB Bench Press,chest,shoulders|triceps,dumbbell,compound,push,horizontal_push,2,strength,"Lie back on an incline bench with a dumbbell on each hand on top of your thighs. The palms of your hand will be facing each other. By using your thighs to help you get the dumbbells up, clean the dumbbells one arm at a time so that you can hold them at shoulder width. Once at shoulder width, keep the palms of your hands with a neutral grip (palms facing each other). Keep your elbows flared out with the upper arms in line with the shoulders (perpendicular to the torso) and the elbows bent creating a 90-degree angle between the upper arm and the forearm. This will be your starting position. Now bring down the weights slowly to your side as you breathe in. Keep full control of the dumbbells at all times. As you breathe out, push the dumbbells up using your pectoral muscles. Lock your arms in the contracted position, hold for a second and then start coming down slowly. Tip: It should take at least twice as long to go down than to come up. Repeat the movement for the prescribed amount of repetitions. When you are done, place the dumbbells back in your thighs and then on the floor. This is the safest manner to dispose of the dumbbells.",2,9,8,7,6,8,3,6,180,4,8,12,90,3,12,20,45,3,15,25,30,3,8,15,60,3
Handstand Push-Ups,shoulders,triceps,body only,compound,push,horizontal_push,5,strength,"With your back to the wall bend at the waist and place both hands on the floor at shoulder width. Kick yourself up against the wall with your arms straight. Your body should be upside down with the arms and legs fully extended. Keep your whole body as straight as possible. Tip: If doing this for the first time, have a spotter help you. Also, make sure that you keep facing the wall with your head, rather than looking down. Slowly lower yourself to the ground as you inhale until your head almost touches the floor. Tip: It is of utmost importance that you come down slow in order to avoid head injury. Push yourself back up slowly as you exhale until your elbows are nearly locked. Repeat for the recommended amount of repetitions.",2,9,8,7,6,8,3,6,180,4,8,12,90,3,12,20,45,3,15,25,30,3,8,15,60,3
Hang Clean,quadriceps,calves|forearms|glutes|hamstrings|lower back|shoulders|traps,barbell,compound,pull,hip_hinge,3,olympic weightlifting,"Begin with a shoulder width, double overhand or hook grip, with the bar hanging at the mid thigh position. Your back should be straight and inclined slightly forward. Begin by aggressively extending through the hips, knees and ankles, driving the weight upward. As you do so, shrug your shoulders towards your ears. Immediately recover by driving through the heels, keeping the torso upright and elbows up. Continue until you have risen to a standing position.",2,9,8,7,6,8,3,6,180,4,8,12,90,3,12,20,45,3,15,25,30,3,8,15,60,3
Hang Clean - Below the Knees,quadriceps,calves|forearms|glutes|hamstrings|lower back|shoulders|traps,barbell,compound,pull,hip_hinge,3,olympic weightlifting,"Begin with a shoulder width, double overhand or hook grip, with the bar hanging just below the knees. Your back should be straight and inclined slightly forward. Begin by aggressively extending through the hips, knees and ankles, driving the weight upward. As you do so, shrug your shoulders towards your ears. As full extension is achieved, transition into the third pull by aggressively shrugging and flexing the arms with the elbows up and out. At peak extension, aggressively pull yourself down, rotating your elbows under the bar as you do so. Receive the bar in a front squat position, the depth of which is dependent upon the height of the bar at the end of the third pull. The bar should be racked onto the protracted shoulders, lightly touching the throat with the hands relaxed. Continue to descend to the bottom squat position, which will help in the recovery. Immediately recover by driving through the heels, keeping the torso upright and elbows up. Continue until you have risen to a standing position.",2,9,8,7,6,8,3,6,180,4,8,12,90,3,12,20,45,3,15,25,30,3,8,15,60,3
Hang Snatch,hamstrings,abdominals|calves|forearms|glutes|lower back|quadriceps|shoulders|traps,barbell,compound,pull,hip_hinge,5,olympic weightlifting,"Begin with a wide grip on the bar, with an overhand or hook grip. The feet should be directly below the hips with the feet turned out. Your knees should be slightly bent, and the torso inclined forward. The spine should be fully extended and the head facing forward. The bar should be at the hips. This will be your starting position. Aggressively extend through the legs and hips. At peak extension, shrug the shoulders and allow the elbows to flex to the side. As you move your feet into the receiving position, forcefully pull yourself below the bar as you elevate the bar overhead. Receive the bar with your body as low as possible and the arms fully extended overhead. Return to a standing position with the weight overhead. Follow by returning the weight to the ground under control.",2,9,8,7,6,8,3,6,180,4,8,12,90,3,12,20,45,3,15,25,30,3,8,15,60,3
Hang Snatch - Below Knees,hamstrings,abdominals|calves|forearms|glutes|lower back|quadriceps|shoulders|traps,barbell,compound,pull,hip_hinge,5,olympic weightlifting,"Begin with a wide grip on the bar, with an overhand or hook grip. The feet should be directly below the hips with the feet turned out. Your knees should be slightly bent, and the torso inclined forward. The spine should be fully extended and the head facing forward. The bar should be just below the knees. This will be your starting position. Aggressively extend through the legs and hips. At peak extension, shrug the shoulders and allow the elbows to flex to the side. As you move your feet into the receiving position, forcefully pull yourself below the bar as you elevate the bar overhead. Receive the bar with your body as low as possible and the arms fully extended overhead. Return to a standing position with the weight overhead, and then return the weight to the floor under control.",2,9,8,7,6,8,3,6,180,4,8,12,90,3,12,20,45,3,15,25,30,3,8,15,60,3
Hanging Bar Good Morning,hamstrings,abdominals|glutes|lower back,barbell,compound,push,hip_hinge,3,powerlifting,"Begin with a bar on a rack at about the same height as your stomach. Suspend the bar using chains or suspension straps. Bend over underneath the bar and rack the bar across the rear of your shoulders as you would a power squat, not on top of your traps. At the proper height, you should be near parallel to the floor when bent over. Keep your back tight, shoulder blades pinched together, and your knees slightly bent. Keep your back arched and your cervical spine in proper alignment. Begin the motion by extending through the hips with your glutes and hamstrings, and you are standing with the weight. Slowly lower the weight back to the starting position, where it is supported by the chains.",2,9,8,7,6,8,3,6,180,4,8,12,90,3,12,20,45,3,15,25,30,3,8,15,60,3
Hanging Leg Raise,abdominals,,body only,isolation,pull,core_flexion,5,strength,Hang from a chin-up bar with both arms extended at arms length in top of you using either a wide grip or a medium grip. The legs should be straight down with the pelvis rolled slightly backwards. This will be your starting position. Raise your legs until the torso makes a 90-degree angle with the legs. Exhale as you perform this movement and hold the contraction for a second or so. Go back slowly to the starting position as you breathe in. Repeat for the recommended amount of repetitions.,5,5,9,7,8,7,6,10,120,3,10,15,60,3,15,25,30,3,20,30,20,2,10,15,60,3
Hanging Pike,abdominals,,body only,compound,pull,core_flexion,5,strength,Hang from a chin-up bar with your legs and feet together using an overhand grip (palms facing away from you) that is slightly wider than shoulder width. Tip: You may use wrist wraps in order to facilitate holding on to the bar. Now bend your knees at a 90 degree angle and bring the upper legs forward so that the calves are perpendicular to the floor while the thighs remain parallel to it. This will be your starting position. Pull your legs up as you exhale until you almost touch your shins with the bar above you. Tip: Try to straighten your legs as much as possible while at the top. Lower your legs as slowly as possible until you reach the starting position. Tip: Avoid swinging and using momentum at all times. Repeat for the recommended amount of repetitions.,2,9,8,7,6,8,3,6,180,4,8,12,90,3,12,20,45,3,15,25,30,3,8,15,60,3
Heaving Snatch Balance,quadriceps,abdominals|forearms|glutes|hamstrings|shoulders|triceps,barbell,compound,push,squat,3,olympic weightlifting,"This drill helps you learn the snatch. Begin by holding a light weight across the back of the shoulders. Your feet should be slightly wider than hip width apart with the feet turned out, the same position that you would perform a squat with. Begin by dipping with the knees slightly, and popping back up to briefly unload the bar. Drive yourself underneath the bar, elevating it overhead as you descend into a full squat. Return to a standing position.",2,9,8,7,6,8,3,6,180,4,8,12,90,3,12,20,45,3,15,25,30,3,8,15,60,3
