name,primaryMuscles,secondaryMuscles,equipment,mechanic,force,movement_pattern,difficulty_level,category,instructions,order_priority,goal_Strength,goal_Muscle,goal_WeightLoss,goal_Endurance,goal_General,Strength_min_reps,Strength_max_reps,Strength_rest_s,Strength_sets,Muscle_min_reps,Muscle_max_reps,Muscle_rest_s,Muscle_sets,WeightLoss_min_reps,WeightLoss_max_reps,WeightLoss_rest_s,WeightLoss_sets,Endurance_min_reps,Endurance_max_reps,Endurance_rest_s,Endurance_sets,General_min_reps,General_max_reps,General_rest_s,General_sets
3/4 Sit-Up,abdominals,,body only,compound,pull,core_flexion,2,strength,"Lie down on the floor and secure your feet. Your legs should be bent at the knees. Place your hands behind or to the side of your head. You will begin with your back on the ground. This will be your starting position. Flex your hips and spine to raise your torso toward your knees. At the top of the contraction your torso should be perpendicular to the ground. Reverse the motion, going only Â¾ of the way down. Repeat for the recommended amount of repetitions.",2,9,8,7,6,8,3,6,180,4,8,12,90,3,12,20,45,3,15,25,30,3,8,15,60,3
Ab Crunch Machine,abdominals,,machine,isolation,pull,core_flexion,3,strength,"Select a light resistance and sit down on the ab machine placing your feet under the pads provided and grabbing the top handles. Your arms should be bent at a 90 degree angle as you rest the triceps on the pads provided. This will be your starting position. At the same time, begin to lift the legs up as you crunch your upper torso. Breathe out as you perform this movement. Tip: Be sure to use a slow and controlled motion. Concentrate on using your abs to move the weight while relaxing your legs and feet. After a second pause, slowly return to the starting position as you breathe in. Repeat the movement for the prescribed amount of repetitions.",5,5,9,7,8,7,6,10,120,3,10,15,60,3,15,25,30,3,20,30,20,2,10,15,60,3
Ab Roller,abdominals,shoulders,other,compound,pull,core_flexion,3,strength,"Hold the Ab Roller with both hands and kneel on the floor. Now place the ab roller on the floor in front of you so that you are on all your hands and knees (as in a kneeling push up position). This will be your starting position. Slowly roll the ab roller straight forward, stretching your body into a straight position. Tip: Go down as far as you can without touching the floor with your body. Breathe in during this portion of the movement. After a pause at the stretched position, start pulling yourself back to the starting position as you breathe out. Tip: Go slowly and keep your abs tight at all times.",2,9,8,7,6,8,3,6,180,4,8,12,90,3,12,20,45,3,15,25,30,3,8,15,60,3
Advanced Kettlebell Windmill,abdominals,glutes|hamstrings|shoulders,kettlebells,isolation,push,other,3,strength,"Clean and press a kettlebell overhead with one arm. Keeping the kettlebell locked out at all times, push your butt out in the direction of the locked out kettlebell. Keep the non-working arm behind your back and turn your feet out at a forty-five degree angle from the arm with the kettlebell. Lower yourself as far as possible. Pause for a second and reverse the motion back to the starting position.",5,5,9,7,8,7,6,10,120,3,10,15,60,3,15,25,30,3,20,30,20,2,10,15,60,3
Air Bike,abdominals,,body only,compound,pull,core_flexion,2,strength,"Lie flat on the floor with your lower back pressed to the ground. For this exercise, you will need to put your hands beside your head. Be careful however to not strain with the neck as you perform it. Now lift your shoulders into the crunch position. Bring knees up to where they are perpendicular to the floor, with your lower legs parallel to the floor. This will be your starting position. Now simultaneously, slowly go through a cycle pedal motion kicking forward with the right leg and bringing in the knee of the left leg. Bring your right elbow close to your left knee by crunching to the side, as you breathe out. Go back to the initial position as you breathe in. Crunch to the opposite side as you cycle your legs and bring closer your left elbow to your right knee and exhale. Continue alternating in this manner until all of the recommended repetitions for each side have been completed.",2,9,8,7,6,8,3,6,180,4,8,12,90,3,12,20,45,3,15,25,30,3,8,15,60,3
Alternate Hammer Curl,biceps,forearms,dumbbell,isolation,pull,elbow_flexion,2,strength,"Stand up with your torso upright and a dumbbell in each hand being held at arms length. The elbows should be close to the torso. The palms of the hands should be facing your torso. This will be your starting position. While holding the upper arm stationary, curl the right weight forward while contracting the biceps as you breathe out. Continue the movement until your biceps is fully contracted and the dumbbells are at shoulder level. Hold the contracted position for a second as you squeeze the biceps. Tip: Only the forearms should move. Slowly begin to bring the dumbbells back to starting position as your breathe in. Repeat the movement with the left hand. This equals one repetition. Continue alternating in this manner for the recommended amount of repetitions.",5,5,9,7,8,7,6,10,120,3,10,15,60,3,15,25,30,3,20,30,20,2,10,15,60,3
Alternate Heel Touchers,abdominals,,body only,isolation,pull,core_flexion,2,strength,"Lie on the floor with the knees bent and the feet on the floor around 18-24 inches apart. Your arms should be extended by your side. This will be your starting position. Crunch over your torso forward and up about 3-4 inches to the right side and touch your right heel as you hold the contraction for a second. Exhale while performing this movement. Now go back slowly to the starting position as you inhale. Now crunch over your torso forward and up around 3-4 inches to the left side and touch your left heel as you hold the contraction for a second. Exhale while performing this movement and then go back to the starting position as you inhale. Now that both heels have been touched, that is considered 1 repetition. Continue alternating sides in this manner until all prescribed repetitions are done.",5,5,9,7,8,7,6,10,120,3,10,15,60,3,15,25,30,3,20,30,20,2,10,15,60,3
Alternate Incline Dumbbell Curl,biceps,forearms,dumbbell,isolation,pull,elbow_flexion,2,strength,"Sit down on an incline bench with a dumbbell in each hand being held at arms length. Tip: Keep the elbows close to the torso.This will be your starting position. While holding the upper arm stationary, curl the right weight forward while contracting the biceps as you breathe out. As you do so, rotate the hand so that the palm is facing up. Continue the movement until your biceps is fully contracted and the dumbbells are at shoulder level. Hold the contracted position for a second as you squeeze the biceps. Tip: Only the forearms should move. Slowly begin to bring the dumbbell back to starting position as your breathe in. Repeat the movement with the left hand. This equals one repetition. Continue alternating in this manner for the recommended amount of repetitions.",5,5,9,7,8,7,6,10,120,3,10,15,60,3,15,25,30,3,20,30,20,2,10,15,60,3
Alternate Leg Diagonal Bound,quadriceps,abductors|adductors|calves|glutes|hamstrings,body only,compound,push,squat,2,plyometrics,"Assume a comfortable stance with one foot slightly in front of the other. Begin by pushing off with the front leg, driving the opposite knee forward and as high as possible before landing. Attempt to cover as much distance to each side with each bound. It may help to use a line on the ground to guage distance from side to side. Repeat the sequence with the other leg.",2,9,8,7,6,8,3,6,180,4,8,12,90,3,12,20,45,3,15,25,30,3,8,15,60,3
Alternating Cable Shoulder Press,shoulders,triceps,cable,compound,push,vertical_push,2,strength,"Move the cables to the bottom of the tower and select an appropriate weight. Grasp the cables and hold them at shoulder height, palms facing forward. This will be your starting position. Keeping your head and chest up, extend through the elbow to press one side directly over head. After pausing at the top, return to the starting position and repeat on the opposite side.",2,9,8,7,6,8,3,6,180,4,8,12,90,3,12,20,45,3,15,25,30,3,8,15,60,3
Alternating Deltoid Raise,shoulders,,dumbbell,isolation,push,shoulder_raise,2,strength,"In a standing position, hold a pair of dumbbells at your side. Keeping your elbows slightly bent, raise the weights directly in front of you to shoulder height, avoiding any swinging or cheating. Return the weights to your side. On the next repetition, raise the weights laterally, raising them out to your side to about shoulder height. Return the weights to the starting position and continue alternating to the front and side.",5,5,9,7,8,7,6,10,120,3,10,15,60,3,15,25,30,3,20,30,20,2,10,15,60,3
Alternating Floor Press,chest,abdominals|shoulders|triceps,kettlebells,compound,push,horizontal_push,2,strength,"Lie on the floor with two kettlebells next to your shoulders. Position one in place on your chest and then the other, gripping the kettlebells on the handle with the palms facing forward. Extend both arms, so that the kettlebells are being held above your chest. Lower one kettlebell, bringing it to your chest and turn the wrist in the direction of the locked out kettlebell. Raise the kettlebell and repeat on the opposite side.",2,9,8,7,6,8,3,6,180,4,8,12,90,3,12,20,45,3,15,25,30,3,8,15,60,3
Alternating Hang Clean,hamstrings,biceps|calves|forearms|glutes|lower back|traps,kettlebells,compound,pull,hip_hinge,3,strength,"Place two kettlebells between your feet. To get in the starting position, push your butt back and look straight ahead. Clean one kettlebell to your shoulder and hold on to the other kettlebell in a hanging position. Clean the kettlebell to your shoulder by extending through the legs and hips as you pull the kettlebell towards your shoulders. Rotate your wrist as you do so. Lower the cleaned kettlebell to a hanging position and clean the alternate kettlebell. Repeat.",2,9,8,7,6,8,3,6,180,4,8,12,90,3,12,20,45,3,15,25,30,3,8,15,60,3
Alternating Kettlebell Press,shoulders,triceps,kettlebells,compound,push,vertical_push,3,strength,"Clean two kettlebells to your shoulders. Clean the kettlebells to your shoulders by extending through the legs and hips as you pull the kettlebells towards your shoulders. Rotate your wrists as you do so. Press one directly overhead by extending through the elbow, turning it so the palm faces forward while holding the other kettlebell stationary . Lower the pressed kettlebell to the starting position and immediately press with your other arm.",2,9,8,7,6,8,3,6,180,4,8,12,90,3,12,20,45,3,15,25,30,3,8,15,60,3
Alternating Kettlebell Row,middle back,biceps|lats,kettlebells,compound,pull,horizontal_pull,3,strength,"Place two kettlebells in front of your feet. Bend your knees slightly and push your butt out as much as possible. As you bend over to get into the starting position grab both kettlebells by the handles. Pull one kettlebell off of the floor while holding on to the other kettlebell. Retract the shoulder blade of the working side, as you flex the elbow, drawing the kettlebell towards your stomach or rib cage. Lower the kettlebell in the working arm and repeat with your other arm.",2,9,8,7,6,8,3,6,180,4,8,12,90,3,12,20,45,3,15,25,30,3,8,15,60,3
Alternating Renegade Row,middle back,abdominals|biceps|chest|lats|triceps,kettlebells,compound,pull,horizontal_pull,5,strength,"Place two kettlebells on the floor about shoulder width apart. Position yourself on your toes and your hands as though you were doing a pushup, with the body straight and extended. Use the handles of the kettlebells to support your upper body. You may need to position your feet wide for support. Push one kettlebell into the floor and row the other kettlebell, retracting the shoulder blade of the working side as you flex the elbow, pulling it to your side. Then lower the kettlebell to the floor and begin the kettlebell in the opposite hand. Repeat for several reps.",2,9,8,7,6,8,3,6,180,4,8,12,90,3,12,20,45,3,15,25,30,3,8,15,60,3
Anti-Gravity Press,shoulders,middle back|traps|triceps,barbell,compound,push,vertical_push,2,strength,"Place a bar on the ground behind the head of an incline bench. Lay on the bench face down. With a pronated grip, pick the barbell up from the floor. Flex the elbows, performing a reverse curl to bring the bar near your chest. This will be your starting position. To begin, press the barbell out in front of your head by extending your elbows. Keep your arms parallel to the ground throughout the movement. Return to the starting position and repeat to complete the set.",2,9,8,7,6,8,3,6,180,4,8,12,90,3,12,20,45,3,15,25,30,3,8,15,60,3
Arnold Dumbbell Press,shoulders,triceps,dumbbell,compound,push,vertical_push,3,strength,"Sit on an exercise bench with back support and hold two dumbbells in front of you at about upper chest level with your palms facing your body and your elbows bent. Tip: Your arms should be next to your torso. The starting position should look like the contracted portion of a dumbbell curl. Now to perform the movement, raise the dumbbells as you rotate the palms of your hands until they are facing forward. Continue lifting the dumbbells until your arms are extended above you in straight arm position. Breathe out as you perform this portion of the movement. After a second pause at the top, begin to lower the dumbbells to the original position by rotating the palms of your hands towards you. Tip: The left arm will be rotated in a counter clockwise manner while the right one will be rotated clockwise. Breathe in as you perform this portion of the movement. Repeat for the recommended amount of repetitions.",2,9,8,7,6,8,3,6,180,4,8,12,90,3,12,20,45,3,15,25,30,3,8,15,60,3
Around The Worlds,chest,shoulders,dumbbell,compound,push,horizontal_push,3,strength,"Lay down on a flat bench holding a dumbbell in each hand with the palms of the hands facing towards the ceiling. Tip: Your arms should be parallel to the floor and next to your thighs. To avoid injury, make sure that you keep your elbows slightly bent. This will be your starting position. Now move the dumbbells by creating a semi-circle as you displace them from the initial position to over the head. All of the movement should happen with the arms parallel to the floor at all times. Breathe in as you perform this portion of the movement. Reverse the movement to return the weight to the starting position as you exhale.",2,9,8,7,6,8,3,6,180,4,8,12,90,3,12,20,45,3,15,25,30,3,8,15,60,3
Atlas Stone Trainer,lower back,biceps|forearms|glutes|hamstrings|quadriceps,other,compound,pull,hip_hinge,3,strongman,"This trainer is effective for developing Atlas Stone strength for those who don't have access to stones, and are typically made from bar ends or heavy pipe. Begin by loading the desired weight onto the bar. Straddle the weight, wrapping your arms around the implement, bending at the hips. Begin by pulling the weight up past the knees, extending through the hips. As the weight clears the knees, it can be lapped by resting it on your thighs and sitting back, hugging it tightly to your chest. Finish the movement by extending through your hips and knees to raise the weight as high as possible. The weight can be returned to the lap or to the ground for successive repetitions.",2,9,8,7,6,8,3,6,180,4,8,12,90,3,12,20,45,3,15,25,30,3,8,15,60,3
Atlas Stones,lower back,abdominals|adductors|biceps|calves|forearms|glutes|hamstrings|middle back|quadriceps|traps,other,compound,pull,hip_hinge,5,strongman,"Begin with the atlas stone between your feet. Bend at the hips to wrap your arms vertically around the Atlas Stone, attempting to get your fingers underneath the stone. Many stones will have a small flat portion on the bottom, which will make the stone easier to hold. Pulling the stone into your torso, drive through the back half of your feet to pull the stone from the ground. As the stone passes the knees, lap it by sitting backward, pulling the stone on top of your thighs. Sit low, getting the stone high onto your chest as you change your grip to reach over the stone. Stand, driving through with your hips. Close distance to the loading platform, and lean back, extending the hips to get the stone as high as possible.",2,9,8,7,6,8,3,6,180,4,8,12,90,3,12,20,45,3,15,25,30,3,8,15,60,3
Axle Deadlift,lower back,forearms|glutes|hamstrings|middle back|quadriceps|traps,other,compound,pull,hip_hinge,3,strongman,"Approach the bar so that it is centered over your feet. You feet should be about hip width apart. Bend at the hip to grip the bar at shoulder width, allowing your shoulder blades to protract. Typically, you would use an over/under grip. With your feet and your grip set, take a big breath and then lower your hips and flex the knees until your shins contact the bar. Look forward with your head, keep your chest up and your back arched, and begin driving through the heels to move the weight upward. After the bar passes the knees, aggressively pull the bar back, pulling your shoulder blades together as you drive your hips forward into the bar. Lower the bar by bending at the hips and guiding it to the floor.",2,9,8,7,6,8,3,6,180,4,8,12,90,3,12,20,45,3,15,25,30,3,8,15,60,3
Back Flyes - With Bands,shoulders,middle back|triceps,bands,isolation,pull,other,2,strength,"Run a band around a stationary post like that of a squat rack. Grab the band by the handles and stand back so that the tension in the band rises. Extend and lift the arms straight in front of you. Tip: Your arms should be straight and parallel to the floor while perpendicular to your torso. Your feet should be firmly planted on the floor spread at shoulder width. This will be your starting position. As you exhale, move your arms to the sides and back. Keep your arms extended and parallel to the floor. Continue the movement until the arms are extended to your sides. After a pause, go back to the original position as you inhale. Repeat for the recommended amount of repetitions.",5,5,9,7,8,7,6,10,120,3,10,15,60,3,15,25,30,3,20,30,20,2,10,15,60,3
Backward Drag,quadriceps,calves|forearms|glutes|hamstrings|lower back,other,compound,pull,other,2,strongman,"Load a sled with the desired weight, attaching a rope or straps to the sled that you can hold onto. Begin the exercise by moving backwards for a given distance. Leaning back, extend through the legs for short steps to move as quickly as possible.",2,9,8,7,6,8,3,6,180,4,8,12,90,3,12,20,45,3,15,25,30,3,8,15,60,3
Backward Medicine Ball Throw,shoulders,,medicine ball,compound,push,horizontal_pull,2,plyometrics,"This exercise is best done with a partner. If you lack a partner, the ball can be thrown and retrieved or thrown against a wall. Begin standing a few meters in front of your partner, both facing the same direction. Begin holding the ball between your legs. Squat down and then forcefully reverse direction, coming to full extension and you toss the ball over your head to your partner. Your partner can then roll the ball back to you. Repeat for the desired number of repetitions.",2,9,8,7,6,8,3,6,180,4,8,12,90,3,12,20,45,3,15,25,30,3,8,15,60,3
Balance Board,calves,hamstrings|quadriceps,other,compound,,other,2,strength,Place a balance board in front of you. Stand up on it and try to balance yourself. Hold the balance for as long as desired.,2,9,8,7,6,8,3,6,180,4,8,12,90,3,12,20,45,3,15,25,30,3,8,15,60,3
Ball Leg Curl,hamstrings,calves|glutes,exercise ball,isolation,pull,knee_flexion,2,strength,"Begin on the floor laying on your back with your feet on top of the ball. Position the ball so that when your legs are extended your ankles are on top of the ball. This will be your starting position. Raise your hips off of the ground, keeping your weight on the shoulder blades and your feet. Flex the knees, pulling the ball as close to you as you can, contracting the hamstrings. After a brief pause, return to the starting position.",5,5,9,7,8,7,6,10,120,3,10,15,60,3,15,25,30,3,20,30,20,2,10,15,60,3
Band Assisted Pull-Up,lats,abdominals|forearms|middle back,bands,compound,,vertical_pull,2,strength,"Choke the band around the center of the pullup bar. You can use different bands to provide varying levels of assistance. Pull the end of the band down, and place one bent knee into the loop, ensuring it won't slip out. Take a medium to wide grip on the bar. This will be your starting position. Pull yourself upward by contracting the lats as you flex the elbow. The elbow should be driven to your side. Pull to the front, attempting to get your chin over the bar. Avoid swinging or jerking movements. After a brief pause, return to the starting position.",2,9,8,7,6,8,3,6,180,4,8,12,90,3,12,20,45,3,15,25,30,3,8,15,60,3
Band Good Morning,hamstrings,glutes|lower back,bands,compound,pull,hip_hinge,2,powerlifting,"Using a 41 inch band, stand on one end, spreading your feet a small amount. Bend at the hips to loop the end of the band behind your neck. This will be your starting position. Keeping your legs straight, extend through the hips to come to a near vertical position. Ensure that you do not round your back as you go down back to the starting position.",2,9,8,7,6,8,3,6,180,4,8,12,90,3,12,20,45,3,15,25,30,3,8,15,60,3
Band Good Morning (Pull Through),hamstrings,glutes|lower back,bands,compound,pull,hip_hinge,2,powerlifting,"Loop the band around a post. Standing a little ways away, loop the opposite end around the neck. Your hands can help hold the band in position. Begin by bending at the hips, getting your butt back as far as possible. Keep your back flat and bend forward to about 90 degrees. Your knees should be only slightly bent. Return to the starting position be driving through with the hips to come back to a standing position.",2,9,8,7,6,8,3,6,180,4,8,12,90,3,12,20,45,3,15,25,30,3,8,15,60,3
Band Hip Adductions,adductors,,bands,isolation,pull,other,2,strength,"Anchor a band around a solid post or other object. Stand with your left side to the post, and put your right foot through the band, getting it around the ankle. Stand up straight and hold onto the post if needed. This will be your starting position. Keeping the knee straight, raise your right legs out to the side as far as you can. Return to the starting position and repeat for the desired rep count. Switch sides.",5,5,9,7,8,7,6,10,120,3,10,15,60,3,15,25,30,3,20,30,20,2,10,15,60,3
Band Pull Apart,shoulders,middle back|traps,bands,isolation,pull,other,2,strength,"Begin with your arms extended straight out in front of you, holding the band with both hands. Initiate the movement by performing a reverse fly motion, moving your hands out laterally to your sides. Keep your elbows extended as you perform the movement, bringing the band to your chest. Ensure that you keep your shoulders back during the exercise. Pause as you complete the movement, returning to the starting position under control.",5,5,9,7,8,7,6,10,120,3,10,15,60,3,15,25,30,3,20,30,20,2,10,15,60,3
Band Skull Crusher,triceps,,bands,isolation,push,elbow_extension,2,strength,"Secure a band to the base of a rack or the bench. Lay on the bench so that the band is lined up with your head. Take hold of the band, raising your elbows so that the upper arm is perpendicular to the floor. With the elbow flexed, the band should be above your head. This will be your starting position. Extend through the elbow to straighten your arm, keeping your upper arm in place. Pause at the top of the motion, and return to the starting position.",5,5,9,7,8,7,6,10,120,3,10,15,60,3,15,25,30,3,20,30,20,2,10,15,60,3
Barbell Ab Rollout,abdominals,lower back|shoulders,barbell,compound,pull,core_flexion,3,strength,"For this exercise you will need to get into a pushup position, but instead of having your hands of the floor, you will be grabbing on to an Olympic barbell (loaded with 5-10 lbs on each side) instead. This will be your starting position. While keeping a slight arch on your back, lift your hips and roll the barbell towards your feet as you exhale. Tip: As you perform the movement, your glutes should be coming up, you should be keeping the abs tight and should maintain your back posture at all times. Also your arms should be staying perpendicular to the floor throughout the movement. If you don't, you will work out your shoulders and back more than the abs. After a second contraction at the top, start to roll the barbell back forward to the starting position slowly as you inhale. Repeat for the recommended amount of repetitions.",2,9,8,7,6,8,3,6,180,4,8,12,90,3,12,20,45,3,15,25,30,3,8,15,60,3
Barbell Ab Rollout - On Knees,abdominals,lower back|shoulders,barbell,compound,pull,core_flexion,5,strength,"Hold an Olympic barbell loaded with 5-10lbs on each side and kneel on the floor. Now place the barbell on the floor in front of you so that you are on all your hands and knees (as in a kneeling push up position). This will be your starting position. Slowly roll the barbell straight forward, stretching your body into a straight position. Tip: Go down as far as you can without touching the floor with your body. Breathe in during this portion of the movement. After a second pause at the stretched position, start pulling yourself back to the starting position as you breathe out. Tip: Go slowly and keep your abs tight at all times.",2,9,8,7,6,8,3,6,180,4,8,12,90,3,12,20,45,3,15,25,30,3,8,15,60,3
