name,primaryMuscles,secondaryMuscles,equipment,mechanic,force,movement_pattern,difficulty_level,category,instructions,order_priority,goal_Strength,goal_Muscle,goal_WeightLoss,goal_Endurance,goal_General,Strength_min_reps,Strength_max_reps,Strength_rest_s,Strength_sets,Muscle_min_reps,Muscle_max_reps,Muscle_rest_s,Muscle_sets,WeightLoss_min_reps,WeightLoss_max_reps,WeightLoss_rest_s,WeightLoss_sets,Endurance_min_reps,Endurance_max_reps,Endurance_rest_s,Endurance_sets,General_min_reps,General_max_reps,General_rest_s,General_sets
Rope Crunch,abdominals,,cable,isolation,pull,core_flexion,2,strength,"Kneel 1-2 feet in front of a cable system with a rope attached. After selecting an appropriate weight, grasp the rope with both hands reaching overhead. Your torso should be upright in the starting position. To begin, flex at the spine, attempting to bring your rib cage to your legs as you pull the cable down. Pause at the bottom of the motion, and then slowly return to the starting position. These can be done with twists or to the side to hit the obliques.",5,5,9,7,8,7,6,10,120,3,10,15,60,3,15,25,30,3,20,30,20,2,10,15,60,3
Rope Straight-Arm Pulldown,lats,,cable,isolation,pull,vertical_pull,2,strength,"Attach a rope to a high pulley and make your weight selection. Stand a couple feet back from the pulley with your feet staggered and take the rope with both hands. Lean forward from the hip, keeping your back straight, with your arms extended up in front of you. This will be your starting position. Keeping your arms straight, extend the shoulder to pull the rope down to your thighs. Pause at the bottom of the motion, squeezing your lats. Return to the starting position without allowing the weight to fully rest on the stack.",5,5,9,7,8,7,6,10,120,3,10,15,60,3,15,25,30,3,20,30,20,2,10,15,60,3
Russian Twist,abdominals,lower back,body only,compound,pull,core_flexion,3,strength,Lie down on the floor placing your feet either under something that will not move or by having a partner hold them. Your legs should be bent at the knees. Elevate your upper body so that it creates an imaginary V-shape with your thighs. Your arms should be fully extended in front of you perpendicular to your torso and with the hands clasped. This is the starting position. Twist your torso to the right side until your arms are parallel with the floor while breathing out. Hold the contraction for a second and move back to the starting position while breathing out. Now move to the opposite side performing the same techniques you applied to the right side. Repeat for the recommended amount of repetitions.,2,9,8,7,6,8,3,6,180,4,8,12,90,3,12,20,45,3,15,25,30,3,8,15,60,3
Sandbag Load,quadriceps,abdominals|biceps|calves|forearms|glutes|hamstrings|lower back|middle back|shoulders|traps,other,compound,pull,other,2,strongman,"To load sandbags or other objects, begin with the implements placed a distance from the loading platform, typically 50 feet. Begin by lifting the sandbag. Sandbags are extremely awkward, and the manner of lifting them can vary depending on the particular sandbag used. Reach as far around it as possible, extending through the hips and knees to pull it up high. Shouldering is usually not allowed. Move as quickly as possible to the platform, and load it, extending through your hips, knees, and ankles to get it as high as possible. Place it onto the platform, ensuring it doesn't fall off. Return to the starting position to retrieve the next sandbag, and repeat until the event is completed.",2,9,8,7,6,8,3,6,180,4,8,12,90,3,12,20,45,3,15,25,30,3,8,15,60,3
Scapular Pull-Up,traps,lats|middle back,body only,compound,pull,vertical_pull,2,strength,"Take a pronated grip on a pull-up bar. From a hanging position, raise yourself a few inches without using your arms. Do this by depressing your shoulder girdle in a reverse shrugging motion. Pause at the completion of the movement, and then slowly return to the starting position before performing more repetitions.",2,9,8,7,6,8,3,6,180,4,8,12,90,3,12,20,45,3,15,25,30,3,8,15,60,3
Scissors Jump,quadriceps,glutes|hamstrings,body only,compound,push,squat,2,plyometrics,"Assume a lunge stance position with one foot forward with the knee bent, and the rear knee nearly touching the ground. Ensure that the front knee is over the midline of the foot. Extending through both legs, jump as high as possible, swinging your arms to gain lift. As you jump as high as you can, switch the position of your legs, moving your front leg to the back and the rear leg to the front. As you land, absorb the impact through the legs by adopting the lunge position, and repeat.",2,9,8,7,6,8,3,6,180,4,8,12,90,3,12,20,45,3,15,25,30,3,8,15,60,3
Seated Band Hamstring Curl,hamstrings,,bands,isolation,pull,knee_flexion,2,strength,"Secure a band close to the ground and place a bench a couple feet away from it. Seat yourself on the bench and secure the band behind your ankles, beginning with your legs straight. This will be your starting position. Flex the knees, bringing your feet towards the bench. You may need to lean back slightly to keep your feet from striking the floor. Pause at the completion of the movement, and then slowly return to the starting position.",5,5,9,7,8,7,6,10,120,3,10,15,60,3,15,25,30,3,20,30,20,2,10,15,60,3
Seated Barbell Military Press,shoulders,triceps,barbell,compound,push,vertical_push,3,strength,"Sit on a Military Press Bench with a bar behind your head and either have a spotter give you the bar (better on the rotator cuff this way) or pick it up yourself carefully with a pronated grip (palms facing forward). Tip: Your grip should be wider than shoulder width and it should create a 90-degree angle between the forearm and the upper arm as the barbell goes down. Once you pick up the barbell with the correct grip length, lift the bar up over your head by locking your arms. Hold at about shoulder level and slightly in front of your head. This is your starting position. Lower the bar down to the collarbone slowly as you inhale. Lift the bar back up to the starting position as you exhale. Repeat for the recommended amount of repetitions.",2,9,8,7,6,8,3,6,180,4,8,12,90,3,12,20,45,3,15,25,30,3,8,15,60,3
Seated Barbell Twist,abdominals,,barbell,isolation,pull,core_flexion,2,strength,"Start out by sitting at the end of a flat bench with a barbell placed on top of your thighs. Your feet should be shoulder width apart from each other. Grip the bar with your palms facing down and make sure your hands are wider than shoulder width apart from each other. Begin to lift the barbell up over your head until your arms are fully extended. Now lower the barbell behind your head until it is resting along the base of your neck. This is the starting position. While keeping your feet and head stationary, move your waist from side to side so that your oblique muscles feel the contraction. Only move from side to side as far as your waist will allow you to go. Stretching or moving too far can cause an injury to occur. Tip: Use a slow and controlled motion. Remember to breathe out while twisting your body to the side and in when moving back to the starting position. Repeat for the recommended amount of repetitions.",5,5,9,7,8,7,6,10,120,3,10,15,60,3,15,25,30,3,20,30,20,2,10,15,60,3
Seated Bent-Over One-Arm Dumbbell Triceps Extension,triceps,,dumbbell,isolation,push,elbow_extension,2,strength,"Sit down at the end of a flat bench with a dumbbell in one arm using a neutral grip (palms of the hand facing you). Bend your knees slightly and bring your torso forward, by bending at the waist, while keeping the back straight until it is almost parallel to the floor. Make sure that you keep the head up. The upper arm with the dumbbell should be close to the torso and aligned with it (lifted up until it is parallel to the floor while the forearms are pointing towards the floor as the hands hold the weights). Tip: There should be a 90-degree angle between the forearms and the upper arm. This is your starting position. Keeping the upper arm stationary, use the triceps to lift the weight as you exhale until the forearm is parallel to the floor and the whole arm is extended. Like many other arm exercises, only the forearm moves. After a second contraction at the top, slowly lower the dumbbell back to the starting position as you inhale. Repeat the movement for the prescribed amount of repetitions. Switch arms and repeat the exercise.",5,5,9,7,8,7,6,10,120,3,10,15,60,3,15,25,30,3,20,30,20,2,10,15,60,3
Seated Bent-Over Rear Delt Raise,shoulders,,dumbbell,isolation,pull,shoulder_raise,3,strength,"Place a couple of dumbbells looking forward in front of a flat bench. Sit on the end of the bench with your legs together and the dumbbells behind your calves. Bend at the waist while keeping the back straight in order to pick up the dumbbells. The palms of your hands should be facing each other as you pick them. This will be your starting position. Keeping your torso forward and stationary, and the arms slightly bent at the elbows, lift the dumbbells straight to the side until both arms are parallel to the floor. Exhale as you lift the weights. (Note: avoid swinging the torso or bringing the arms back as opposed to the side.) After a one second contraction at the top, slowly lower the dumbbells back to the starting position. Repeat for the recommended amount of repetitions.",5,5,9,7,8,7,6,10,120,3,10,15,60,3,15,25,30,3,20,30,20,2,10,15,60,3
Seated Bent-Over Two-Arm Dumbbell Triceps Extension,triceps,,dumbbell,isolation,push,elbow_extension,3,strength,"Sit down at the end of a flat bench with a dumbbell in both arms using a neutral grip (palms of the hand facing you). Bend your knees slightly and bring your torso forward, by bending at the waist, while keeping the back straight until it is almost parallel to the floor. Make sure that you keep the head up. The upper arms with the dumbbells should be close to the torso and aligned with it (lifted up until they are parallel to the floor while the forearms are pointing towards the floor as the hands hold the weights). Tip: There should be a 90-degree angle between the forearms and the upper arm. This is your starting position. Keeping the upper arms stationary, use the triceps to lift the weight as you exhale until the forearms are parallel to the floor and the whole arm is extended. Like many other arm exercises, only the forearm moves. After a second contraction at the top, slowly lower the dumbbells back to the starting position as you inhale. Repeat the movement for the prescribed amount of repetitions.",5,5,9,7,8,7,6,10,120,3,10,15,60,3,15,25,30,3,20,30,20,2,10,15,60,3
Seated Cable Rows,middle back,biceps|lats|shoulders,cable,compound,pull,horizontal_pull,2,strength,"For this exercise you will need access to a low pulley row machine with a V-bar. Note: The V-bar will enable you to have a neutral grip where the palms of your hands face each other. To get into the starting position, first sit down on the machine and place your feet on the front platform or crossbar provided making sure that your knees are slightly bent and not locked. Lean over as you keep the natural alignment of your back and grab the V-bar handles. With your arms extended pull back until your torso is at a 90-degree angle from your legs. Your back should be slightly arched and your chest should be sticking out. You should be feeling a nice stretch on your lats as you hold the bar in front of you. This is the starting position of the exercise. Keeping the torso stationary, pull the handles back towards your torso while keeping the arms close to it until you touch the abdominals. Breathe out as you perform that movement. At that point you should be squeezing your back muscles hard. Hold that contraction for a second and slowly go back to the original position while breathing in. Repeat for the recommended amount of repetitions.",2,9,8,7,6,8,3,6,180,4,8,12,90,3,12,20,45,3,15,25,30,3,8,15,60,3
Seated Cable Shoulder Press,shoulders,triceps,cable,compound,push,vertical_push,2,strength,"Adjust the weight to an appropriate amount and be seated, grasping the handles. Your upper arms should be about 90 degrees to the body, with your head and chest up. The elbows should also be bent to about 90 degrees. This will be your starting position. Begin by extending through the elbow, pressing the handles together above your head. After pausing at the top, return the handles to the starting position. Ensure that you maintain tension on the cables. You can also execute this movement with your back off the pad and alternate hands.",2,9,8,7,6,8,3,6,180,4,8,12,90,3,12,20,45,3,15,25,30,3,8,15,60,3
Seated Calf Raise,calves,,machine,isolation,push,calf,2,strength,"Sit on the machine and place your toes on the lower portion of the platform provided with the heels extending off. Choose the toe positioning of your choice (forward, in, or out) as per the beginning of this chapter. Place your lower thighs under the lever pad, which will need to be adjusted according to the height of your thighs. Now place your hands on top of the lever pad in order to prevent it from slipping forward. Lift the lever slightly by pushing your heels up and release the safety bar. This will be your starting position. Slowly lower your heels by bending at the ankles until the calves are fully stretched. Inhale as you perform this movement. Raise the heels by extending the ankles as high as possible as you contract the calves and breathe out. Hold the top contraction for a second. Repeat for the recommended amount of repetitions.",5,5,9,7,8,7,6,10,120,3,10,15,60,3,15,25,30,3,20,30,20,2,10,15,60,3
Seated Close-Grip Concentration Barbell Curl,biceps,,barbell,isolation,pull,elbow_flexion,3,strength,"Sit down on a flat bench with a barbell or E-Z Bar in front of you in between your legs. Your legs should be spread with the knees bent and the feet on the floor. Use your arms to pick the barbell up and place the back of your upper arms on top of your inner thighs (around three and a half inches away from the front of the knee). A supinated grip closer than shoulder width is needed to perform this exercise. Tip: Your arm should be extended at arms length and the barbell should be above the floor. This will be your starting position. While holding the upper arms stationary, curl the weights forward while contracting the biceps as you breathe out. Only the forearms should move. Continue the movement until your biceps are fully contracted and the dumbbells are at shoulder level. Hold the contracted position for a second as you squeeze the biceps. Slowly begin to bring the barbell back to starting position as your breathe in. Tip: Avoid swinging motions at any time. Repeat for the recommended amount of repetitions.",5,5,9,7,8,7,6,10,120,3,10,15,60,3,15,25,30,3,20,30,20,2,10,15,60,3
Seated Dumbbell Curl,biceps,,dumbbell,isolation,pull,elbow_flexion,2,strength,"Sit on a flat bench with a dumbbell on each hand being held at arms length. The elbows should be close to the torso. Rotate the palms of the hands so that they are facing your torso. This will be your starting position. While holding the upper arm stationary, curl the weights and start twisting the wrists once the dumbbells pass your thighs so that the palms of your hands face forward at the end of the movement. Make sure that you contract the biceps as you breathe out and make sure that only the forearms move. Continue the movement until your biceps are fully contracted and the dumbbells are at shoulder level. Hold the contracted position for a second as you squeeze the biceps. Slowly begin to bring the dumbbells back to the starting position as your breathe in and as you rotate the wrists back to a neutral grip. Repeat for the recommended amount of repetitions.",5,5,9,7,8,7,6,10,120,3,10,15,60,3,15,25,30,3,20,30,20,2,10,15,60,3
Seated Dumbbell Inner Biceps Curl,biceps,,dumbbell,isolation,pull,elbow_flexion,2,strength,"Sit on the end of a flat bench with a dumbbell in each hand being held at arms length. The elbows should be close to the torso. Rotate the palms of the hands so that they are facing inward in a neutral position. This will be your starting position. While holding the upper arms stationary, curl the dumbbells out and up, turning the palms out as you lift and keeping your forearms in line with your outer deltoids. Tips: Only the forearms should move. Continue the movement until your biceps are fully contracted and the dumbbells are at shoulder level. Hold the contracted position for a second as you squeeze the biceps. Slowly begin to bring the dumbbells back to the starting position as your breathe in. Remember to rotate your arms as you lower the dumbbells so that you can switch back to a neutral grip. Repeat for the recommended amount of repetitions.",5,5,9,7,8,7,6,10,120,3,10,15,60,3,15,25,30,3,20,30,20,2,10,15,60,3
Seated Dumbbell Palms-Down Wrist Curl,forearms,,dumbbell,isolation,pull,elbow_flexion,2,strength,"Start out by placing two dumbbells on the floor in front of a flat bench. Sit down on the edge of the flat bench with your legs at about shoulder width apart. Make sure to keep your feet on the floor. Use your arms to grab both of the dumbbells and bring them up so that your forearms are resting against your thighs with the palms of the hands facing down. Your wrists should be hanging over the edge of your thighs. Start out by curling your wrist upwards and exhaling. Slowly lower your wrists back down to the starting position while inhaling. Make sure to inhale during this part of the exercise. Tip: Your forearms should be stationary as your wrist is the only movement needed to perform this exercise. Repeat for the recommended amount of repetitions. When finished, simply lower the dumbbells to the floor.",5,5,9,7,8,7,6,10,120,3,10,15,60,3,15,25,30,3,20,30,20,2,10,15,60,3
Seated Dumbbell Palms-Up Wrist Curl,forearms,,dumbbell,isolation,pull,elbow_flexion,2,strength,"Start out by placing two dumbbells on the floor in front of a flat bench. Sit down on the edge of the flat bench with your legs at about shoulder width apart. Make sure to keep your feet on the floor. Use your arms to grab both of the dumbbells and bring them up so that your forearms are resting against your thighs with the palms of the hands facing up. Your wrists should be hanging over the edge of your thighs. Start out by curling your wrist upwards and exhaling. Slowly lower your wrists back down to the starting position while inhaling. Make sure to inhale during this part of the exercise. Tip: Your forearms should be stationary as your wrist is the only movement needed to perform this exercise. Repeat for the recommended amount of repetitions. When finished, simply lower the dumbbells to the floor.",5,5,9,7,8,7,6,10,120,3,10,15,60,3,15,25,30,3,20,30,20,2,10,15,60,3
Seated Dumbbell Press,shoulders,triceps,dumbbell,compound,push,vertical_push,2,strength,"Grab a couple of dumbbells and sit on a military press bench or a utility bench that has a back support on it as you place the dumbbells upright on top of your thighs. Clean the dumbbells up one at a time by using your thighs to bring the dumbbells up to shoulder height at each side. Rotate the wrists so that the palms of your hands are facing forward. This is your starting position. As you exhale, push the dumbbells up until they touch at the top. After a second pause, slowly come down back to the starting position as you inhale. Repeat for the recommended amount of repetitions.",2,9,8,7,6,8,3,6,180,4,8,12,90,3,12,20,45,3,15,25,30,3,8,15,60,3
Seated Flat Bench Leg Pull-In,abdominals,,body only,compound,pull,core_flexion,2,strength,"Sit on a bench with the legs stretched out in front of you slightly below parallel and your arms holding on to the sides of the bench. Your torso should be leaning backwards around a 45-degree angle from the bench. This will be your starting position. Bring the knees in toward you as you move your torso closer to them at the same time. Breathe out as you perform this movement. After a second pause, go back to the starting position as you inhale. Repeat for the recommended amount of repetitions.",2,9,8,7,6,8,3,6,180,4,8,12,90,3,12,20,45,3,15,25,30,3,8,15,60,3
Seated Good Mornings,lower back,glutes,barbell,compound,pull,hip_hinge,3,powerlifting,"Set up a box in a power rack. The pins should be set at an appropriate height. Begin by stepping under the bar and placing it across the back of the shoulders, not on top of your traps. Squeeze your shoulder blades together and rotate your elbows forward, attempting to bend the bar across your shoulders. Remove the bar from the rack, creating a tight arch in your lower back. Keep your head facing forward. With your back, shoulders, and core tight, push your knees and butt out and you begin your descent. Sit back with your hips until you are seated on the box. This will be your starting position. Keeping the bar tight, bend forward at the hips as much as possible. If you set the pins to what would be parallel, you not only have a safety if you fail, but know when to stop. Pause just above the pins and reverse the motion until your torso it upright.",2,9,8,7,6,8,3,6,180,4,8,12,90,3,12,20,45,3,15,25,30,3,8,15,60,3
Seated Head Harness Neck Resistance,neck,,other,isolation,pull,other,3,strength,"Place a neck strap on the floor at the end of a flat bench. Once you have selected the weights, sit at the end of the flat bench with your feet wider than shoulder width apart from each other. Your toes should be pointed out. Slowly move your torso forward until it is almost parallel with the floor. Using both hands, securely position the neck strap around your head. Tip: Make sure the weights are still lying on the floor to prevent any strain on the neck. Now grab the weight with both hands while elevating your torso back until it is almost perpendicular to the floor. Note: Your head and torso needs to be slightly tilted forward to perform this exercise. Now place both hands on top of your knees. This is the starting position. Slowly lower your neck down until your chin touches the upper part of your chest while breathing in. While exhaling, bring your neck back to the starting position. Repeat for the recommended amount of repetitions.",5,5,9,7,8,7,6,10,120,3,10,15,60,3,15,25,30,3,20,30,20,2,10,15,60,3
Seated Leg Curl,hamstrings,,machine,isolation,pull,knee_flexion,2,strength,"Adjust the machine lever to fit your height and sit on the machine with your back against the back support pad. Place the back of lower leg on top of padded lever (just a few inches under the calves) and secure the lap pad against your thighs, just above the knees. Then grasp the side handles on the machine as you point your toes straight (or you can also use any of the other two stances) and ensure that the legs are fully straight right in front of you. This will be your starting position. As you exhale, pull the machine lever as far as possible to the back of your thighs by flexing at the knees. Keep your torso stationary at all times. Hold the contracted position for a second. Slowly return to the starting position as you breathe in. Repeat for the recommended amount of repetitions.",5,5,9,7,8,7,6,10,120,3,10,15,60,3,15,25,30,3,20,30,20,2,10,15,60,3
Seated Leg Tucks,abdominals,,body only,isolation,pull,core_flexion,2,strength,"Sit on a bench with the legs stretched out in front of you slightly below parallel and your arms holding on to the sides of the bench. Your torso should be leaning backwards around a 45-degree angle from the bench. This will be your starting position. Bring the knees in toward you as you move your torso closer to them at the same time. Breathe out as you perform this movement. After a second pause, go back to the starting position as you inhale. Repeat for the recommended amount of repetitions.",5,5,9,7,8,7,6,10,120,3,10,15,60,3,15,25,30,3,20,30,20,2,10,15,60,3
Seated One-Arm Dumbbell Palms-Down Wrist Curl,forearms,,dumbbell,isolation,pull,elbow_flexion,3,strength,"Sit on a flat bench with a dumbbell in your right hand. Place your feet flat on the floor, at a distance that is slightly wider than shoulder width apart. Lean forward and place your right forearm on top of your upper right thigh with your palm down. Tip: Make sure that the back of the wrist lies on top of your knees. This will be your starting position. Lower the dumbbell as far as possible as you keep a tight grip on the dumbbell. Inhale as you perform this movement. Now curl the dumbbell as high as possible as you contract the forearms and as you exhale. Keep the contraction for a second before you lower again. Tip: The only movement should happen at the wrist. Perform for the recommended amount of repetitions, switch arms and repeat the movement.",5,5,9,7,8,7,6,10,120,3,10,15,60,3,15,25,30,3,20,30,20,2,10,15,60,3
Seated One-Arm Dumbbell Palms-Up Wrist Curl,forearms,,dumbbell,isolation,pull,elbow_flexion,2,strength,"Sit on a flat bench with a dumbbell in your right hand. Place your feet flat on the floor, at a distance that is slightly wider than shoulder width apart. Lean forward and place your right forearm on top of your upper right thigh with your palm up. Tip: Make sure that the front of the wrist lies on top of your knees. This will be your starting position. Lower the dumbbell as far as possible as you keep a tight grip on the dumbbell. Inhale as you perform this movement. Now curl the dumbbell as high as possible as you contract the forearms and as you exhale. Keep the contraction for a second before you lower again. Tip: The only movement should happen at the wrist. Perform for the recommended amount of repetitions, switch arms and repeat the movement.",5,5,9,7,8,7,6,10,120,3,10,15,60,3,15,25,30,3,20,30,20,2,10,15,60,3
