name,primaryMuscles,secondaryMuscles,equipment,mechanic,force,movement_pattern,difficulty_level,category,instructions,order_priority,goal_Strength,goal_Muscle,goal_WeightLoss,goal_Endurance,goal_General,Strength_min_reps,Strength_max_reps,Strength_rest_s,Strength_sets,Muscle_min_reps,Muscle_max_reps,Muscle_rest_s,Muscle_sets,WeightLoss_min_reps,WeightLoss_max_reps,WeightLoss_rest_s,WeightLoss_sets,Endurance_min_reps,Endurance_max_reps,Endurance_rest_s,Endurance_sets,General_min_reps,General_max_reps,General_rest_s,General_sets
Squat – Dumbbell,glutes|lower back|quadriceps|adductors,calves,dumbbell,compound,,squat,3,strength,"Stand with your feet shoulder-width apart, with your toes pointing slightly outward. Hold a dumbbell in each hand by your sides, with your palms facing inward. Engage your core and keep your chest lifted throughout the movement. Lower your body by bending at the hips and knees as if sitting on a chair. Keep your weight in your heels, and make sure your knees are tracking over your toes. Lower your body until your thighs are parallel to the ground or until you reach your desired depth. Push through your heels to stand back up to the starting position. Repeat.",2,9,8,7,6,8,3,6,180,4,8,12,90,3,12,20,45,3,15,25,30,3,8,15,60,3
Deadlift – Barbell,glutes|hamstrings|lower back,calves|forearms|traps|quadriceps,barbell,compound,,hip_hinge,3,strength,"Stand with your feet roughly hip-width apart, with the barbell positioned over the middle of your feet. Bend at your hips and knees to reach down and grasp the barbell with both hands, slightly wider than shoulder-width apart, palms facing towards your body. With a flat back, engage your core, flatten your shoulder blades and look ahead to keep your neck in a neutral position. Stand up with the weight by pushing through your heels, keeping the bar close to your body, and driving your hips forward. Straighten your legs and hips to come to a full standing position, with the barbell hanging in front of your thighs. Do not lean back at the top. Pause briefly at the top of the lift while maintaining a tight core, and take a breath if needed. Lower the barbell back to the ground by hinging at the hips and bending the knees, keeping the bar close to your body and your back straight. Place the barbell back on the ground and return to the starting position, ready to perform the next repetition.",2,9,8,7,6,8,3,6,180,4,8,12,90,3,12,20,45,3,15,25,30,3,8,15,60,3
Leg Press – Machine,glutes|quadriceps|adductors,hamstrings,machine,compound,,squat,3,strength,Adjust the seat of the leg press machine so that your knees are at a ~90-degree angle when your feet are on the footplate. Sit on the machine and place your feet shoulder-width apart on the footplate. Push the footplate away from your body by extending your legs. Lower the footplate back towards your body by bending your legs and keeping your feet flat on the plate. Repeat.,2,9,8,7,6,8,3,6,180,4,8,12,90,3,12,20,45,3,15,25,30,3,8,15,60,3
One-Handed Cross-Body Curl,biceps,forearms,body only,isolation,,elbow_flexion,3,strength,"Stand up, leaning slightly forward from a straight position, feet shoulder-width apart, and your knees slightly bent. Hold a dumbbell in each hand, with your palms facing your body and arms fully extended at your sides. This is your starting position. Keeping your elbows close to your body, slowly curl one dumbbell up toward your opposite shoulder, across your body. Continue curling until the weight comes close to the activating bicep's shoulder. Squeeze your bicep before slowly lowering the weight to the starting position. Repeat the curl on the opposite side. Continue alternating curls on each side for the desired number of repetitions.",5,5,9,7,8,7,6,10,120,3,10,15,60,3,15,25,30,3,20,30,20,2,10,15,60,3
Frog Pumps,glutes,hamstrings|adductors,body only,compound,,other,3,strength,"Lie on your back with your knees bent and your feet flat on the ground. Keep your feet close together and your heels touching. Bring your feet up towards your hips along the ground until they're about 6 inches apart, and then let your knees fall out to the sides so that your feet are touching each other. This is the starting position. Engage your glutes and lift your hips up towards the ceiling as high as you can, making sure to keep your feet and knees in the same position. Hold the top position for 1-2 seconds, then slowly lower your hips to the starting position. Repeat.",2,9,8,7,6,8,3,6,180,4,8,12,90,3,12,20,45,3,15,25,30,3,8,15,60,3
Lying Windshield Wiper,abdominals,abdominals,body only,compound,,other,3,strength,"Lie flat on your back with your arms extended out to the sides, palms down, and your legs extended straight up towards the ceiling. Keep your feet together and engage your core muscles by drawing your navel towards your spine. Lower your legs to one side, keeping them straight and close to the floor without touching it. Pause briefly and then lift your legs back up to the starting position. Repeat the movement, this time lowering your legs to the opposite side. Continue alternating sides for the desired number of reps or time.",2,9,8,7,6,8,3,6,180,4,8,12,90,3,12,20,45,3,15,25,30,3,8,15,60,3
Dip – Bar,chest|triceps,shoulders,body only,compound,,horizontal_push,3,strength,"Start by approaching a set of parallel bars or dip bars approximately shoulder-width apart. Grab each bar with an overhand grip and hoist yourself up so your arms are fully extended, and your feet are off the ground. Slightly lean forward and keep your elbows slightly bent to engage your chest, shoulders, and triceps muscles. Lower your body by bending your elbows and leaning forward while keeping your back straight and your legs behind you. Keep your elbows close to your body throughout the entire exercise. Continue lowering yourself until your arms are parallel to the ground, or slightly below parallel, while inhaling. Push back up by straightening your arms while exhaling. Be sure to push with your triceps, chest, and shoulder muscles to return to your starting position. Repeat.",2,9,8,7,6,8,3,6,180,4,8,12,90,3,12,20,45,3,15,25,30,3,8,15,60,3
Arnold Press,shoulders,,dumbbell,compound,,vertical_push,3,strength,"Hold a dumbbell in each hand and sit or stand with your feet shoulder-width apart. Start with your arms bent so that your palms face your body and the dumbbells are at shoulder height. As you press the dumbbells overhead, rotate your palms to face forward. Continue to press the dumbbells overhead until your arms are fully extended. Lower the dumbbells back down to the starting position, rotating your palms back to face your body as you do so. Repeat.",2,9,8,7,6,8,3,6,180,4,8,12,90,3,12,20,45,3,15,25,30,3,8,15,60,3
Back Extension,glutes|hamstrings|lower back,abdominals,body only,isolation,,hip_hinge,3,strength,"Adjust the back extension bench so that the pads at the thigh are snug against your thighs and your feet are securely held in place by the footpads. Cross your arms over your chest or hold them behind your head. Keep your back straight and your neck in a neutral position. Hang your body forward over the thigh pads. This is the starting position. Engage your lower back muscles and slowly lift your upper body off the bench until it aligns with your legs. Hold this position for up to a few seconds, squeezing your glutes and lower back muscles at the top of the movement. Slowly lower your upper body back down to the starting position. Repeat.",5,5,9,7,8,7,6,10,120,3,10,15,60,3,15,25,30,3,20,30,20,2,10,15,60,3
One-Legged Glute Bridge,glutes|hamstrings,adductors,body only,compound,,hip_hinge,3,strength,Start by lying on your back with your knees bent and feet flat on the ground. Lift your right leg off the ground and extend it straight up towards the ceiling. Press your left foot into the ground and lift your hips up towards the ceiling. Pause at the top of the movement and squeeze your glutes. Lower your hips back down to the ground and repeat for the desired number of reps. Switch legs and repeat the exercise on the other side.,2,9,8,7,6,8,3,6,180,4,8,12,90,3,12,20,45,3,15,25,30,3,8,15,60,3
Curl – Bodyweight,biceps|lats,forearms,body only,isolation,,elbow_flexion,3,strength,"Adjust the height of the rings or TRX to waist height and stand facing them. Hold the rings or TRX handles with an underhand grip and lean back, extending your arms straight in front of you. Keep your feet shoulder-width apart and your body in a straight line from head to heels. Engage your biceps and bend your elbows, pulling your body up towards the rings or TRX handles. As you pull your body up, keep your elbows close to your body and your wrists straight. When your hands reach your chest, pause for a moment and then slowly lower your body back down to the starting position. Repeat the exercise for the desired number of reps.",5,5,9,7,8,7,6,10,120,3,10,15,60,3,15,25,30,3,20,30,20,2,10,15,60,3
Burpee – BOSU,chest|glutes|quadriceps|shoulders,abdominals|traps,body only,compound,,other,3,strength,"Start in a standing position with the BOSU ball on the ground (inflated-side down) in front of you. Grip the edges of the BOSU ball and jump your feet back into a plank position. Perform a push-up while gripping the BOSU ball. Jump your feet back towards the BOSU ball into a low squat position. Complete the squat by standing up. As you rise, lift the BOSU ball overhead, extending your arms towards the ceiling. Repeat the exercise for desired number of reps.",2,9,8,7,6,8,3,6,180,4,8,12,90,3,12,20,45,3,15,25,30,3,8,15,60,3
Shoulder Press – Machine,shoulders,shoulders|triceps,machine,compound,,vertical_push,3,strength,"Adjust the seat height so that the handles are at shoulder level. Sit on the machine with your back against the pad and your feet flat on the floor. Grasp the handles with an overhand grip and push them upward until your arms are fully extended. Slowly lower the handles back down to shoulder level, keeping your elbows slightly bent. Repeat for desired number of repetitions.",2,9,8,7,6,8,3,6,180,4,8,12,90,3,12,20,45,3,15,25,30,3,8,15,60,3
Leg Extension,quadriceps,,body only,isolation,,knee_extension,3,strength,"Adjust the machine to fit your body and select the appropriate weight. Sit on the machine with your back against the backrest and your feet or ankle flat against the supporting pad. Grasp the handles on the side of the machine for stability. Extend your legs out in front of you until they are parallel to the floor, keeping your feet flexed and your knees slightly bent. Hold for a moment, then slowly lower the weight back down to the starting position. Repeat.",5,5,9,7,8,7,6,10,120,3,10,15,60,3,15,25,30,3,20,30,20,2,10,15,60,3
Close-Grip Feet-Up Bench Press – Barbell,triceps,chest|shoulders,barbell,compound,,horizontal_push,3,strength,"Lie flat on a bench with your feet up and your back pressed against the bench. Grasp the barbell with your hands shoulder-width apart or just slightly narrower. Unrack the barbell and hold it above your chest with your arms extended. Lower the barbell to your chest, keeping your elbows close to your body. Pause briefly at the bottom of the movement, then press the barbell back up to the starting position. Repeat.",2,9,8,7,6,8,3,6,180,4,8,12,90,3,12,20,45,3,15,25,30,3,8,15,60,3
Rear Delt Row – Barbell,shoulders|traps,forearms|shoulders|lats,barbell,isolation,,horizontal_pull,3,strength,"Stand with your feet shoulder-width apart and your knees slightly bent. Hold a barbell with an overhand grip, hands shoulder-width apart. Lean forward at the hips, keeping your back straight and your abs engaged. Bring the barbell up towards your upper chest, keeping your elbows wide and out to the sides. Squeeze your shoulder blades together at the top of the movement. Lower the barbell back down to the starting position. Repeat.",5,5,9,7,8,7,6,10,120,3,10,15,60,3,15,25,30,3,20,30,20,2,10,15,60,3
Hip Abduction – Machine,abductors,glutes,machine,isolation,,other,3,strength,"Adjust the machine to fit your height and leg length. Sit on the machine with your back against the backrest and your feet on the footrests. Press your legs outward against the resistance of the machine. With your knees at their farthest point, hold the weight for a moment before slowly releasing the resistance and returning to the starting position. Repeat.",5,5,9,7,8,7,6,10,120,3,10,15,60,3,15,25,30,3,20,30,20,2,10,15,60,3
Cable Curl – Rope,biceps,forearms,cable,isolation,,elbow_flexion,3,strength,"Attach a rope to a low pulley cable machine. Stand facing the machine with feet shoulder-width apart and knees slightly bent. Grasp the rope with an underhand grip, palms facing each other. Keep elbows close to your sides and curl the rope towards your shoulders. Pause briefly at the top of the movement, then slowly lower the rope back to the starting position. Repeat.",5,5,9,7,8,7,6,10,120,3,10,15,60,3,15,25,30,3,20,30,20,2,10,15,60,3
Plank - BOSU,abdominals|lower back,abdominals|shoulders,body only,compound,,core_flexion,3,strength,Place a BOSU ball on the ground with the flat side facing up. Assume a plank position with your forearms on the BOSU ball and your toes on the ground. Engage your core and keep your body in a straight line from head to heels. Hold the position for the desired amount of time. Release the position by lowering your knees to the ground.,2,9,8,7,6,8,3,6,180,4,8,12,90,3,12,20,45,3,15,25,30,3,8,15,60,3
Glute Kickback – Machine,glutes,hamstrings|adductors,machine,isolation,,hip_hinge,3,strength,"Adjust the machine to fit your body height Position yourself in the machine with your hands on the handles and one ankle on the padding. Keeping your core engaged, exhale and extend your leg back as far as possible while squeezing your glutes. Inhale and slowly return your leg to the starting position. Repeat.",5,5,9,7,8,7,6,10,120,3,10,15,60,3,15,25,30,3,20,30,20,2,10,15,60,3
Pause Squat – Barbell,glutes|lower back|quadriceps|adductors,calves,barbell,compound,,squat,3,strength,"Start with your feet shoulder-width apart, your toes pointing slightly outward, and the barbell on your shoulders. Lower your body into a squat position, keeping your back straight and your knees tracking with your toes. Pause at the bottom of the squat for 2-3 seconds. Slowly rise back up to the starting position. Repeat.",2,9,8,7,6,8,3,6,180,4,8,12,90,3,12,20,45,3,15,25,30,3,8,15,60,3
Walking Lunge – Barbell,glutes|quadriceps|adductors,,barbell,compound,,lunge,3,strength,"Start with your feet hip-width apart and the barbell on your shoulders. Take a large step forward with your right foot, lowering your body until your right thigh is parallel to the ground and your left knee is hovering just above the floor. Push through your right heel to stand back up, bringing your left foot forward to meet your right foot. Repeat the lunge on the other side by stepping forward with your left foot. Continue alternating lunges for the desired number of reps or distance.",2,9,8,7,6,8,3,6,180,4,8,12,90,3,12,20,45,3,15,25,30,3,8,15,60,3
Rotational Throw – Medicine Ball,abdominals,abdominals|shoulders,medicine ball,compound,,horizontal_pull,3,strength,"Start by standing about arms-length away from the wall with your feet shoulder-width apart. Hold a medicine ball with both hands at chest height. Rotating your core and upper body towards the wall, explosively throw the ball against the wall. Catch the ball as it rebounds off the wall and rotate your body away from the wall. Repeat for the desired number of reps and then switch sides.",2,9,8,7,6,8,3,6,180,4,8,12,90,3,12,20,45,3,15,25,30,3,8,15,60,3
Row – T-Bar,lats|shoulders|traps,biceps|forearms|lower back|shoulders,barbell,compound,,horizontal_pull,3,strength,"Load the desired weight onto the T-Bar machine. Lie down on the T-Bar machine with your feet securely planted. Grasp the handles of the T-Bar with an overhand grip. Pull the T-Bar towards your chest, keeping your elbows close to your body. Pause briefly at the top of the movement, squeezing your shoulder blades together. Slowly lower the T-Bar back to the starting position. Repeat.",2,9,8,7,6,8,3,6,180,4,8,12,90,3,12,20,45,3,15,25,30,3,8,15,60,3
Shoulder Press – Dumbbell,shoulders,shoulders|triceps,dumbbell,compound,,vertical_push,3,strength,"Start by standing with your feet shoulder-width apart, holding a dumbbell in each hand by your thighs. Raise the dumbbells to shoulder height, palms facing forward, and elbows bent. Press the dumbbells upward until your arms are fully extended above your head. Pause for a moment at the top of the movement, then slowly lower the dumbbells back down to shoulder height. Repeat.",2,9,8,7,6,8,3,6,180,4,8,12,90,3,12,20,45,3,15,25,30,3,8,15,60,3
Upright Row – Barbell,shoulders,biceps|shoulders|traps,barbell,compound,,horizontal_pull,3,strength,"Stand with your feet shoulder-width apart and your knees slightly bent. Grasp the barbell with an overhand grip, hands narrower than shoulder-width apart. Hold the barbell in front of your thighs with your arms extended. Exhale and lift the barbell straight up towards your chin, keeping it close to your body. Pause for a moment at the top of the movement, then inhale and slowly lower the barbell back down to the starting position. Repeat.",2,9,8,7,6,8,3,6,180,4,8,12,90,3,12,20,45,3,15,25,30,3,8,15,60,3
Rear Delt Row – Dumbbell,shoulders|traps,forearms|shoulders|lats,dumbbell,isolation,,horizontal_pull,3,strength,"Stand up straight holding a dumbbell in each hand with an overhand grip, palms facing your thighs. Hinge forward at the hips with a slight bend in the knees, keeping your back straight and nearly parallel to the floor. Let the dumbbells hang directly in front of you with your arms fully extended. This is the starting position. Keep your eyes looking slightly ahead to maintain neck alignment with your spine. Exhale as you pull the dumbbells towards your upper chest, keeping your elbows flared out. Imagine you are squeezing your shoulder blades together. Hold the contraction for a second when the dumbbells reach the peak position when your upper arm is just beyond horizontal. Inhale as you slowly lower the dumbbells back to the starting position in a controlled manner. Repeat the movement for the desired number of repetitions.",5,5,9,7,8,7,6,10,120,3,10,15,60,3,15,25,30,3,20,30,20,2,10,15,60,3
Floor Press – Dumbbell,chest|shoulders,triceps,dumbbell,compound,,horizontal_push,3,strength,"Lie flat on your back on the floor with your knees bent and feet flat on the ground. Hold a dumbbell in each hand with your palms facing towards your feet. Extend your arms straight up towards the ceiling, with your elbows slightly bent. Slowly lower the dumbbells down towards your chest, keeping your elbows close to your body. Pause when your upper arms touch the ground. Repeat.",2,9,8,7,6,8,3,6,180,4,8,12,90,3,12,20,45,3,15,25,30,3,8,15,60,3
Incline Curl – Dumbbell,biceps,forearms,dumbbell,isolation,,elbow_flexion,3,strength,"Adjust the bench to a 45-degree angle. Grab a pair of dumbbells and sit on the bench with your back straight. Let your arms hang down by your sides with your palms facing forward. Slowly curl the dumbbells up towards your shoulders while keeping your elbows close to your body. Pause for a moment at the top of the movement, then slowly lower the dumbbells back down to the starting position. Repeat.",5,5,9,7,8,7,6,10,120,3,10,15,60,3,15,25,30,3,20,30,20,2,10,15,60,3
Eccentric Heel Drop,calves,,body only,compound,,other,3,strength,"Stand on a raised platform or step with the balls of your feet on the edge and your heels hanging off. Raise your heels up as high as possible with both feet. Shift your weight onto one leg and slowly lower your heel down below the platform, only using the single leg. Use both feet to push yourself back up to the raised position. Switch your weight to the other foot and lower yourself down single-legged. Continue alternating sides for the desired number of repetitions.",2,9,8,7,6,8,3,6,180,4,8,12,90,3,12,20,45,3,15,25,30,3,8,15,60,3
Squat – Belt,glutes|quadriceps|adductors,calves,body only,compound,,squat,3,strength,Add your desired weight to the machine. Attach a belt or harness around your waist. Attach a cable or chain to the belt or harness. Stand on a platform or box with feet shoulder-width apart. Hold onto a stable object for balance. Squat by bending the knees and hips while keeping the back straight. Pause at the bottom of the squat and then push up through the legs to return to the starting position. Repeat.,2,9,8,7,6,8,3,6,180,4,8,12,90,3,12,20,45,3,15,25,30,3,8,15,60,3
Hang Power Clean,glutes|lower back,forearms|hamstrings|adductors|traps,body only,compound,,hip_hinge,3,strength,"Stand with feet shoulder-width apart, gripping a barbell at thigh level with palms facing you. This is your starting position. Bend your knees slightly and hinge at the waist to bring the barbell just above knee level. Keep your back straight and core tight. Explosively extend your hips and knees. At the same time, shrug your shoulders and pull the barbell up along your body. As the barbell reaches chest height, rotate your wrists under the bar and push your body slightly under it. Catch the bar on the front part of your shoulders with a slight bend in your knees (higher than a full squat). Stand up fully with the barbell in the front rack position. Lower the bar back to the starting position. Repeat for the desired number of repetitions.",2,9,8,7,6,8,3,6,180,4,8,12,90,3,12,20,45,3,15,25,30,3,8,15,60,3
V-Up,abdominals,,body only,compound,,core_flexion,3,strength,"Start by lying on your back with your arms extended above your head and your legs straight out in front of you. Engage your core muscles and lift your legs up to a 45-degree angle while simultaneously lifting your upper body off the ground. Reach your arms forward and try to touch your toes with your fingertips. Hold the position long enough to flex your abdominal muscles, then slowly lower your body back down to the starting position. Repeat.",2,9,8,7,6,8,3,6,180,4,8,12,90,3,12,20,45,3,15,25,30,3,8,15,60,3
Hack Squat – Barbell,quadriceps,calves|forearms|glutes|lower back|adductors|traps,barbell,compound,,squat,3,strength,"Stand in front of the barbell with your feet shoulder-width apart. The barbell will be by the back of your calves. Bend down and grip the barbell with an overhand grip, with your palms facing behind you. Stand up straight, lifting the barbell off the ground and holding it behind your legs. Keeping your back straight, lower your body by bending your knees and hips, as if you were sitting down on a chair, until your thighs are parallel to the ground. Push through your heels to stand back up to the starting position. Repeat.",2,9,8,7,6,8,3,6,180,4,8,12,90,3,12,20,45,3,15,25,30,3,8,15,60,3
Straight Arm Lat Pulldown,lats,shoulders,cable,compound,,vertical_pull,3,strength,"Adjust the cable machine to a high position and attach a straight bar to the cable. Stand facing the machine with your feet shoulder-width apart and your knees slightly bent. Grasp the bar with both hands using an overhand grip, with your hands slightly wider than shoulder-width apart. Engage your core and keep your arms straight as you pull the bar down towards your thighs, using your lats to initiate the movement. Pause for a moment at the bottom of the movement, then slowly release the bar back up to the starting position. Repeat.",2,9,8,7,6,8,3,6,180,4,8,12,90,3,12,20,45,3,15,25,30,3,8,15,60,3
Lying Internal Shoulder Rotation – Dumbbell,shoulders,,dumbbell,compound,,other,3,strength,"Lie on your side on a flat bench with your legs stacked, and your body straight as possible from head to toes. Bend your lower arm (the one closest to the bench) at a 90-degree angle at your elbow, and grasp a dumbbell with a your palm facing the ceiling. Rotate your shoulder while keeping your elbow at a 90-degree angle, moving your forearm towards the ceiling and inwards towards your body. Rotate your arm upward as far as comfortably possible without lifting your elbow off the bench or your body moving off its position. Pause at the top of the movement for a brief moment. Slowly return the dumbbell to the starting position by rotating the forearm back to the bench while keeping the elbow angle constant. Complete all the desired repetitions on one arm before switching to the other arm and repeating the steps.",2,9,8,7,6,8,3,6,180,4,8,12,90,3,12,20,45,3,15,25,30,3,8,15,60,3
Squat – Landmine,glutes|quadriceps|adductors,calves,barbell,compound,,squat,3,strength,"Start by placing a barbell into a landmine attachment or securely anchor it into a corner. Stand facing the barbell with your feet shoulder-width apart and your toes pointing slightly outward. Grab the end of the barbell with both hands and lift it up to your chest. Lower your hips down and back, keeping your chest up and your back straight. Bend your knees and lower your body until your thighs are parallel to the ground. Push through your heels and stand back up to the starting position. Repeat.",2,9,8,7,6,8,3,6,180,4,8,12,90,3,12,20,45,3,15,25,30,3,8,15,60,3
Push-Up – Feet in Rings,chest|shoulders|triceps,abdominals,body only,compound,,horizontal_push,3,strength,Start in a plank position with your feet in the rings and your hands shoulder-width apart on the ground. Lower your body towards the ground by bending your elbows and keeping your body straight. Push yourself back up to the starting position by straightening your arms. Repeat.,2,9,8,7,6,8,3,6,180,4,8,12,90,3,12,20,45,3,15,25,30,3,8,15,60,3
